{
    "schema_version":  "1.0",
    "kind":  "proxtel-skill",
    "id":  "auditor-web",
    "display_name":  "PROXTEL Auditor Web",
    "area":  "development",
    "lifecycle":  {
                      "state":  "approved",
                      "version":  "1.0.0"
                  },
    "scope":  {
                  "level":  "reusable-project",
                  "provider_specific":  false,
                  "providers":  [
                                    "claude",
                                    "codex",
                                    "antigravity"
                                ]
              },
    "purpose":  {
                    "summary":  "Audita sitios web y frontends en modo inicialmente read-only, con evidencia verificable sobre estructura, UX/UI, responsive, accesibilidad, rendimiento, SEO visible, navegador y mantenibilidad. Usala para diagnosticar antes de modificar.",
                    "use_when":  [
                                     "The request matches the specialized responsibility of auditor-web.",
                                     "The capability will be reused across more than one project."
                                 ],
                    "do_not_use_when":  [
                                            "A simple deterministic Tool is sufficient.",
                                            "The task belongs primarily to another PROXTEL area.",
                                            "The request would require exceeding project or user authorization."
                                        ]
                },
    "capabilities":  {
                         "responsibilities":  [
                                                  "Perform evidence-based read-only web/frontend audits by default.",
                                                  "Inspect structure, semantics, responsive behavior, UX/UI, accessibility, browser behavior, performance and visible SEO when applicable.",
                                                  "Separate verified facts, probable issues and recommendations.",
                                                  "Use browser or Playwright checks when available and authorized.",
                                                  "Produce prioritized findings and an actionable roadmap."
                                              ],
                         "limits":  [
                                        "Do not modify files during an audit-only request.",
                                        "Do not execute destructive browser actions.",
                                        "Do not invent metrics or line numbers.",
                                        "Do not reproduce secrets.",
                                        "Do not replace specialist security/accessibility/performance audits when deeper scope is required."
                                    ],
                         "completion_criteria":  [
                                                     "Available scope inspected.",
                                                     "Findings contain evidence and priority.",
                                                     "Limitations are explicit.",
                                                     "Working tree is unchanged for audit-only tasks."
                                                 ]
                     },
    "dependencies":  [

                     ],
    "resources":  {
                      "skill_md":  "SKILL.md",
                      "scripts":  [

                                  ],
                      "references":  [
                                         {
                                             "path":  "references/legacy-baseline.md",
                                             "purpose":  "Immutable provenance copy of the legacy PROXTEL baseline used for modernization comparison."
                                         },
                                         {
                                             "path":  "references/modernization-notes.md",
                                             "purpose":  "Governance and migration notes for the canonical candidate."
                                         }
                                     ],
                      "assets":  [

                                 ]
                  },
    "security":  {
                     "network":  {
                                     "level":  "controlled",
                                     "description":  "Network use is limited to authorized project/browser/research activity relevant to the task."
                                 },
                     "filesystem_write":  {
                                              "level":  "none",
                                              "description":  "Writes are limited to explicitly authorized implementation scope; audit-only work remains read-only."
                                          },
                     "filesystem_delete":  {
                                               "level":  "none",
                                               "description":  "Deletion is never implicit and must remain within authorized reversible project scope."
                                           },
                     "subprocess":  {
                                        "level":  "read-only",
                                        "description":  "CLI execution is limited to project inspection, tests, lint, build or authorized local implementation."
                                    },
                     "environment_access":  {
                                                "level":  "read-only",
                                                "description":  "Environment/config may be inspected when necessary without exposing secrets."
                                            },
                     "secret_access":  {
                                           "level":  "none",
                                           "description":  "The Skill must not request, reveal or persist secrets."
                                       },
                     "privilege_required":  false
                 },
    "compatibility":  {
                          "platforms":  [
                                            "windows",
                                            "macos",
                                            "linux"
                                        ],
                          "providers":  [
                                            "claude",
                                            "codex",
                                            "antigravity"
                                        ]
                      },
    "testing":  {
                    "required":  true,
                    "trigger_tests":  true,
                    "task_evals":  true,
                    "baseline_comparison":  true
                },
    "provenance":  {
                       "origin_type":  "proxtel-internal",
                       "sources":  [
                                       {
                                           "type":  "internal",
                                           "name":  "skills/base/auditor-web/SKILL.md",
                                           "url":  null,
                                           "commit":  null,
                                           "license":  null
                                       }
                                   ]
                   }
}